<?xml version="1.0" encoding="UTF-8"?>

<!ELEMENT prediccion (municipios)>
    <!ATTLIST prediccion xmlns:xsi CDATA #IMPLIED
        xsi:noNamespaceSchemaLocation CDATA #IMPLIED>
<!ELEMENT municipios (dias)>
<!ELEMENT dias (prob_precipitacion,estado_cielo,viento,temperatura)>
    <!ATTLIST dias fecha CDATA #REQUIRED>
<!ELEMENT prob_precipitacion (#PCDATA)>
<!ELEMENT estado_cielo (#PCDATA)>
    <!ATTLIST estado_cielo descripcion CDATA #REQUIRED>
<!ELEMENT viento (direccion,velocidad)>
<!ELEMENT direccion (#PCDATA)>
<!ELEMENT velocidad (#PCDATA)>
<!ELEMENT temperatura (maxima,minima)>
<!ELEMENT maxima (#PCDATA)>
<!ELEMENT minima (#PCDATA)>
